{
  "model": "Qwen/Qwen2.5-0.5B",
  "n_params_b": 0.49,
  "n_layers": 24,
  "hidden_dim": 896,
  "protocol": {
    "layer_select_seed": 42,
    "eval_seeds": [
      43,
      44,
      45,
      46,
      47,
      48,
      49
    ],
    "target_ex_per_dim": 600,
    "n_train_tokens": 537600,
    "batch_size": 8,
    "layers_per_pass": 1
  },
  "peak_layer_final": 19,
  "peak_layer_frac": 0.79,
  "layer_profile": {
    "0": 0.1510658827017934,
    "1": 0.15877431737731612,
    "2": 0.13539926938056931,
    "3": 0.14511678848354118,
    "4": 0.15311413160555182,
    "5": 0.14897015791689974,
    "6": 0.15327738055410184,
    "7": 0.15610705388122884,
    "8": 0.14654127174402026,
    "9": 0.15001260271886063,
    "10": 0.15217241916905594,
    "11": 0.14644340646257553,
    "12": 0.1536717272108143,
    "13": 0.16369902803322203,
    "14": 0.1562017544353694,
    "15": 0.161326110498613,
    "16": 0.17860903450827226,
    "17": 0.18042167086124375,
    "18": 0.17450015170577327,
    "19": 0.19074378658291197,
    "20": 0.17085632260999306,
    "21": 0.1953481399224794,
    "22": 0.166301308243897,
    "23": 0.16815684369833644
  },
  "multi_layer_eval": {
    "16": {
      "mean": 0.20577016173837528,
      "std": 0.022054709498504403,
      "per_seed": [
        0.19044256193381878,
        0.22909197030087353,
        0.17902331665063664,
        0.20281067005147016,
        0.1793058172114317,
        0.23438770862231428,
        0.2253290873980817
      ],
      "seed_agreement": 0.9696164766728608
    },
    "17": {
      "mean": 0.20318219101606477,
      "std": 0.020564344666800946,
      "per_seed": [
        0.1910735616537396,
        0.22444484666124986,
        0.1786314651219223,
        0.20168971322063967,
        0.17570684670487183,
        0.22832763431609113,
        0.22240126943393926
      ],
      "seed_agreement": 0.9671257837682122
    },
    "19": {
      "mean": 0.21536179509261122,
      "std": 0.019633955825303646,
      "per_seed": [
        0.20621102232093985,
        0.23427637638619458,
        0.1971709039176129,
        0.20608279724265083,
        0.18732853416713957,
        0.24023543730197983,
        0.23622749431176102
      ],
      "seed_agreement": 0.9587002618615931
    },
    "21": {
      "mean": 0.1911344371359661,
      "std": 0.006690405149122212,
      "per_seed": [
        0.19190265032560716,
        0.20275059737162077,
        0.18706634576252335,
        0.19827493012849026,
        0.18366051041714604,
        0.18378542489549096,
        0.1905006010508842
      ],
      "seed_agreement": 0.9437774917969621
    }
  },
  "partial_corr": {
    "mean": 0.21536179509261122,
    "std": 0.019633955825303646,
    "per_seed": [
      0.20621102232093985,
      0.23427637638619458,
      0.1971709039176129,
      0.20608279724265083,
      0.18732853416713957,
      0.24023543730197983,
      0.23622749431176102
    ],
    "n_seeds": 7,
    "split": "validation (held-out seeds)"
  },
  "test_split_comparison": {
    "mean": 0.19967961193913927,
    "per_seed": [
      0.1932060987897259,
      0.22236859672179338,
      0.18346414030589855
    ]
  },
  "seed_agreement": {
    "mean": 0.9587002618615931
  },
  "output_controlled": {
    "mean": 0.05866745143727097,
    "per_seed": [
      0.04992095488668256,
      0.07797946151937143,
      0.048101937905758924
    ]
  },
  "baselines": {
    "ff_goodness": 0.0002041263719293351,
    "active_ratio": -0.014647519305245032,
    "act_entropy": -0.11537260002091057,
    "activation_norm": 0.01399708710469654,
    "random_head": -0.05469764224999479
  },
  "cross_domain": {
    "wikitext": 0.21255276754158245,
    "c4": 0.17893363569050638,
    "c4_within": 0.022131210716386712
  },
  "control_sensitivity": {
    "none": 0.5336789100287808,
    "softmax_only": 0.20594424875896053,
    "norm_only": 0.5330602570442959,
    "standard": 0.20621102232093985,
    "plus_entropy": 0.01860565521671733,
    "nonlinear": 0.21101886821517132
  },
  "flagging_6a": {
    "n_tokens": 193347,
    "summary": {
      "0.05": {
        "observer_exclusive": 5345.333333333333
      },
      "0.1": {
        "observer_exclusive": 8383.333333333334
      },
      "0.2": {
        "observer_exclusive": 12177.666666666666
      },
      "0.3": {
        "observer_exclusive": 13175.0
      }
    }
  },
  "provenance": {
    "model_revision": "060db6499f32faf8b98477b0a26969ef7d8b9987",
    "script": "scripts/run_model.py",
    "timestamp": "2026-04-11T01:50:52+00:00",
    "value_source": "runtime",
    "device": "cuda"
  }
}